name,rating,text,positive
Palmer Park,5,"Beautiful area and one of my favorite local parks inside Colorado Springs. The area has magnificent views of the mountains and multiple trails of varying difficulty for hikers of all levels.

I've been returning here at least once a month or so for the last couple years ♥️",True
Palmer Park,5,Very beautiful park with plenty of trails to hike/walk.  Very dog friendly park with several parking and picnic areas throughout.  Just a reminder of how beautiful Colorado can be even amongst the city.,True
Palmer Park,5,"Very pretty, rocky hike with views on either side. Got the heart pumping!",True
Palmer Park,5,A beautiful place for an intimate wedding ceremony! I had a blast with the beautiful views,True
Warner Parks,5,Great hugely spread out park off of Highway 100 south west of downtown Nashville. Lots of picnic tables and spots doting throughout the park and the one these pics are from is the Little Harpeth River Pavilions. Whenever I'm in the Nashville area I think of all the memories of enjoying the great hiking trails and streams that are dog & pet friendly. A must stop for me every time!,True
Warner Parks,5,"You need to go mountain biking here. There’s all sorts of difficulties and climbs, but also some very flowy descents. There’s this beautiful trail at the end of the connector trail, and a very steep rock climb. There was also deer running in the forest WITH US as we rode and it was so cool. Super fun!",True
Warner Parks,5,"When I was living in Nashville last year, this was always an amazing park to visit for some nature therapy.

Miles of beautiful woods and well-maintained trails. I spent countless hours just meandering around and often disregarding the original route I intended to take. Perfect place for some solitude or a stroll in the woods with friends or family.",True
Warner Parks,5,"This park is very beautiful and clean!  We did a photoshoot here and it was absolutely gorgeous!  You do not need to pay a fee nor get a license to do professional  photoshoots here.

People visiting the Park were so accommodating.  They would see the photographer and stop to let us have our shots without being asked. Lots of well-behaved, leashed pets and we even saw a horse.  We were told there were also hiking trails.  On the day we went (Saturday sfternoon), parking was tight but there were spaces across the road from the Park. If you go on the weekend, go early to allow for time to find a parking spot.

I plan to go back to really explore it more.",True
Warner Parks,5,Such a beautiful area to explore or go hiking! I saw 5 deer which I felt like was a crazy amount to see in an afternoon. Wonderful time and definitely going back for another adventure.,True
South Valley Park,5,"This was a good alternative to Roxborough if it’s too crowded.  Beautiful red rock formations. A loop trail. Not challenging.  No shade, so if it’s warmer, you might need sunscreen and some water!",True
South Valley Park,3,We hiked the Coyote Song and Columbine Trails.  Nice little hike without a lot of incline.  Lots of beautiful rock outcrops here.  Bikers will love the Columbine trail.  Not very many trees so you’re out in the open sun/wind.,False
South Valley Park,5,Incredible location especially in the fall! I had a couple hire me to photograph a surprise proposal here and South Valley Park was the perfect backdrop. Theres cell service but it wasn't busy at sunrise and we had the whole place to ourselves.,True
South Valley Park,5,"We stumbled on this gem of a park.  The rock formations are incredible.  Even for a hazy day, the views were remarkable.",True
South Valley Park,5,Beautiful short hike and great place for a beginner whose hiking for the 1st time!,True
Bear Creek Trail Parking,5,It's really beautiful out there but don't forget your sunscreen and bug repellant!,True
Bear Creek Trail Parking,5,Nice and peaceful trail most of the time. Not very big but nice walk.,True
Bear Creek Trail Parking,5,So close to so much. Very convenient. Love the history of the Stone House.,True
Bear Creek Trail Parking,5,"We park here at least once a day so we can take our dog for a walk. The trails are kept up and even after snow they have been plowed and cleared. Luka, the dog loves to also go down on the dirt paths past the bridge and sniff and sniff.",True
Bear Creek Trail Parking,4,Nice spot for walk or bike ride. Fishing was a bust but still nice spot.,False
Bluffs Regional Park Trail,5,"Great trail with some decent inclines but overall easy to trek! The parking lot can get crowded but there is parking available along the street leading up to the lot. Be sure to take the time to walk along the two overpasses, there are some good views.",True
Bluffs Regional Park Trail,5,This is such a nice little trail run/hiking area. Oftentimes the highlight of my day/week. Careful in the summer of rattlesnakes if you go to the back trail since it's less trafficked and they like to sun bathe.,True
Bluffs Regional Park Trail,5,I was invited here and I loved it. Easy trail to hike with a wonderful view of the city and surroundings. I love coming back here and I recommend anyone who would like to get a nice easy hike or bike ride to come here with the extra gift of the view.,True
Bluffs Regional Park Trail,5,Beautiful place to walk even when it is a bit chilly out. There were some nice terrain changes which can be a bit challenging with the altitude if you're not acclimated to it. The views of the city and the mountains were wonderful and the park was very peaceful and quiet. Overall great place to walk that is well maintained and easy to find and access.,True
Bluffs Regional Park Trail,5,"One of the most beautiful nearby spots to watch the sunset, take a daily walk or run, and walk your fur babies (my babies favorite spot). The total trail is around 3 miles, with options for both short and long routes to reach the top.",True
Sand Creek Park,3,"Went for a walk to get some fish air. A nice park with people walking their dogs, spending time with their kids, and biking.  There were, at one point, some not so nice people and questionable cars that arrived, so it was time for at least me to go. All in all though, it was nice.",False
Sand Creek Park,4,"Wonderful place to take a nice walk with friends and family. Lovely open space, a lake with multiple species of birds. Activity areas for kids to build things.",False
Sand Creek Park,5,This park offers a wonderful escape from the daily hustle and bustle. I genuinely love spending time here.,True
Sand Creek Park,5,"This is a beautiful natural open space with several large ponds, streams, walking trails and even a few pocket parks. Our dog loves to jump in for a swim. Highly recommended!",True
Sand Creek Park,4,"A good walking park with great views! Almost in the heart of the city. Tons of wildlife in the area. The park also has a few bridges and small waterfall type structures. A little dirty here and there, some people don't pick up their animals waste. There was also a bullet in the parking lot (not against guns but, not good for a park). Over all its a nice place, might want to avoid it at dark.",False
